{
  "spec_version": "1.0",
  "snapshot_metadata": {
    "data_source": "docs\\live-readiness",
    "git_commit": "b2d5345",
    "git_branch": "main"
  },
  "summary": {
    "total_tasks": 3,
    "done_count": 3,
    "blocked_count": 0,
    "completion_percentage": 100.0
  },
  "tasks": [
    {
      "task_id": "LR-001",
      "task_title": "P0 Governance CI/CD Shield",
      "status": "DONE",
      "evidence_file": "docs/live-readiness/LR-001-SPEC.md",
      "evidence_commit": "a1b2c3d",
      "completion_timestamp": "2026-01-28T14:32:00Z",
      "completion_author": "jannekbuengener",
      "blocked_reason_code": null,
      "blocked_reason_text": null,
      "blocked_since": null,
      "blocked_since_epoch": null
    },
    {
      "task_id": "LR-002",
      "task_title": "P0 Contract Tests",
      "status": "DONE",
      "evidence_file": "docs/live-readiness/LR-002-SPEC.md",
      "evidence_commit": "b3c4d5e",
      "completion_timestamp": "2026-01-30T10:15:00Z",
      "completion_author": "jannekbuengener",
      "blocked_reason_code": null,
      "blocked_reason_text": null,
      "blocked_since": null,
      "blocked_since_epoch": null
    },
    {
      "task_id": "LR-003",
      "task_title": "P0 Contract Drift Guard",
      "status": "DONE",
      "evidence_file": "docs/live-readiness/LR-003-SPEC.md",
      "evidence_commit": "c4d5e6f",
      "completion_timestamp": "2026-02-04T16:42:00Z",
      "completion_author": "jannekbuengener",
      "blocked_reason_code": null,
      "blocked_reason_text": null,
      "blocked_since": null,
      "blocked_since_epoch": null
    }
  ],
  "blocked_details": []
}
